{
  "components": [
    {
      "artifact": {
        "filename": "cffi-2.1.0-cp312-cp312-manylinux2014_x86_64.manylinux_2_17_x86_64.whl",
        "sha256": "1e9f50d192a3e525b15a75ab5114e442d83d657b7ec29182a991bc9a88fd3a66",
        "url": "https://files.pythonhosted.org/packages/62/f2/c9522a81c32132799a1972c39f5c5f8b4c8b9f00488a23feaa6c06f07741/cffi-2.1.0-cp312-cp312-manylinux2014_x86_64.manylinux_2_17_x86_64.whl"
      },
      "direct": false,
      "name": "cffi",
      "purl": "pkg:pypi/cffi@2.1.0",
      "version": "2.1.0"
    },
    {
      "artifact": {
        "filename": "cryptography-50.0.1-cp311-abi3-manylinux2014_x86_64.manylinux_2_17_x86_64.whl",
        "sha256": "ff838d62ec1bfce4f9ba7fa16f4a7b554cd8d0c299e6be37502161a660c84eef",
        "url": "https://files.pythonhosted.org/packages/57/26/e6d4fc8512a51a5f9ee7bfdbfb853bce1197087df40c9ad993ad370b846f/cryptography-50.0.1-cp311-abi3-manylinux2014_x86_64.manylinux_2_17_x86_64.whl"
      },
      "direct": true,
      "name": "cryptography",
      "purl": "pkg:pypi/cryptography@50.0.1",
      "version": "50.0.1"
    },
    {
      "artifact": {
        "filename": "iniconfig-2.3.0-py3-none-any.whl",
        "sha256": "f631c04d2c48c52b84d0d0549c99ff3859c98df65b3101406327ecc7d53fbf12",
        "url": "https://files.pythonhosted.org/packages/cb/b1/3846dd7f199d53cb17f49cba7e651e9ce294d8497c8c150530ed11865bb8/iniconfig-2.3.0-py3-none-any.whl"
      },
      "direct": false,
      "name": "iniconfig",
      "purl": "pkg:pypi/iniconfig@2.3.0",
      "version": "2.3.0"
    },
    {
      "artifact": {
        "filename": "packaging-26.2-py3-none-any.whl",
        "sha256": "5fc45236b9446107ff2415ce77c807cee2862cb6fac22b8a73826d0693b0980e",
        "url": "https://files.pythonhosted.org/packages/df/b2/87e62e8c3e2f4b32e5fe99e0b86d576da1312593b39f47d8ceef365e95ed/packaging-26.2-py3-none-any.whl"
      },
      "direct": false,
      "name": "packaging",
      "purl": "pkg:pypi/packaging@26.2",
      "version": "26.2"
    },
    {
      "artifact": {
        "filename": "pluggy-1.6.0-py3-none-any.whl",
        "sha256": "e920276dd6813095e9377c0bc5566d94c932c33b27a3e3945d8389c374dd4746",
        "url": "https://files.pythonhosted.org/packages/54/20/4d324d65cc6d9205fabedc306948156824eb9f0ee1633355a8f7ec5c66bf/pluggy-1.6.0-py3-none-any.whl"
      },
      "direct": false,
      "name": "pluggy",
      "purl": "pkg:pypi/pluggy@1.6.0",
      "version": "1.6.0"
    },
    {
      "artifact": {
        "filename": "pycparser-3.0-py3-none-any.whl",
        "sha256": "b727414169a36b7d524c1c3e31839a521725078d7b2ff038656844266160a992",
        "url": "https://files.pythonhosted.org/packages/0c/c3/44f3fbbfa403ea2a7c779186dc20772604442dde72947e7d01069cbe98e3/pycparser-3.0-py3-none-any.whl"
      },
      "direct": false,
      "name": "pycparser",
      "purl": "pkg:pypi/pycparser@3.0",
      "version": "3.0"
    },
    {
      "artifact": {
        "filename": "pygments-2.20.0-py3-none-any.whl",
        "sha256": "81a9e26dd42fd28a23a2d169d86d7ac03b46e2f8b59ed4698fb4785f946d0176",
        "url": "https://files.pythonhosted.org/packages/f4/7e/a72dd26f3b0f4f2bf1dd8923c85f7ceb43172af56d63c7383eb62b332364/pygments-2.20.0-py3-none-any.whl"
      },
      "direct": false,
      "name": "pygments",
      "purl": "pkg:pypi/pygments@2.20.0",
      "version": "2.20.0"
    },
    {
      "artifact": {
        "filename": "pytest-9.0.3-py3-none-any.whl",
        "sha256": "2c5efc453d45394fdd706ade797c0a81091eccd1d6e4bccfcd476e2b8e0ab5d9",
        "url": "https://files.pythonhosted.org/packages/d4/24/a372aaf5c9b7208e7112038812994107bc65a84cd00e0354a88c2c77a617/pytest-9.0.3-py3-none-any.whl"
      },
      "direct": true,
      "name": "pytest",
      "purl": "pkg:pypi/pytest@9.0.3",
      "version": "9.0.3"
    },
    {
      "artifact": {
        "filename": "pyyaml-6.0.3-cp312-cp312-manylinux2014_x86_64.manylinux_2_17_x86_64.manylinux_2_28_x86_64.whl",
        "sha256": "ba1cc08a7ccde2d2ec775841541641e4548226580ab850948cbfda66a1befcdc",
        "url": "https://files.pythonhosted.org/packages/8b/9d/b3589d3877982d4f2329302ef98a8026e7f4443c765c46cfecc8858c6b4b/pyyaml-6.0.3-cp312-cp312-manylinux2014_x86_64.manylinux_2_17_x86_64.manylinux_2_28_x86_64.whl"
      },
      "direct": true,
      "name": "pyyaml",
      "purl": "pkg:pypi/pyyaml@6.0.3",
      "version": "6.0.3"
    }
  ],
  "environment": {
    "abi": "cp312",
    "arch": "x86_64",
    "implementation": "CPython",
    "os": "linux",
    "profile": "development",
    "python_version": "3.12"
  },
  "evidence_class": "cross-target-pip-resolution-requiring-native-ci-confirmation",
  "evidence_id": "development-linux-cp312",
  "normalization_notes": [
    "pip cross-target resolution used both manylinux_2_27_x86_64 and manylinux2014_x86_64 selectors so target-compatible Pillow manylinux_2_27 and Playwright manylinux1 wheels are both considered; selected target artifacts remain exact and require native CI confirmation."
  ],
  "platform_policy": "Exact lowest-common lock with target-selected PyPI wheels",
  "resolved_at": "2026-10-01T01:02:22Z",
  "resolver": "pip / PyPI",
  "schema_version": "1.0.0",
  "source_date_epoch": 1790816542,
  "source_environment": {
    "implementation_name": "cpython",
    "implementation_version": "3.12.8",
    "os_name": "posix",
    "platform_machine": "arm64",
    "platform_python_implementation": "CPython",
    "platform_release": "25.5.0",
    "platform_system": "Darwin",
    "platform_version": "Darwin Kernel Version 25.5.0: Mon Apr 27 20:41:12 PDT 2026; root:xnu-12377.121.6~2/RELEASE_ARM64_T6050",
    "python_full_version": "3.12.8",
    "python_version": "3.12",
    "sys_platform": "darwin"
  },
  "source_pip_version": "26.2.1",
  "source_report_sha256": "8847430e49e0a0aee23c140a342adeec155539342515c1818043b8ab3c346027"
}
